keyword,cluster,intent,funnel_stage,audience_fit,priority,page_type,keep,drop_reason
simulation lab jobs near me,IRRELEVANT_OR_NAVIGATIONAL,COMMERCIAL,TOFU,LOW,LOW,NONE,FALSE,LOCAL_SERVICE_INTENT_NEAR_ME
simulation lab kya hota hai,IRRELEVANT_OR_NAVIGATIONAL,INFORMATIONAL,TOFU,LOW,LOW,NONE,FALSE,NOT_RELEVANT_TO_PRODUCT_OFFER
hands on bible teacher blog,IRRELEVANT_OR_NAVIGATIONAL,NAVIGATIONAL,TOFU,LOW,LOW,NONE,FALSE,IRRELEVANT_ENTITY_OR_BRAND
hands on teaching tools llc,IRRELEVANT_OR_NAVIGATIONAL,NAVIGATIONAL,TOFU,LOW,LOW,NONE,FALSE,IRRELEVANT_ENTITY_OR_BRAND
hands on method of teaching,IRRELEVANT_OR_NAVIGATIONAL,INFORMATIONAL,TOFU,LOW,LOW,NONE,FALSE,NOT_RELEVANT_TO_PRODUCT_OFFER
what is virtual lab school,IRRELEVANT_OR_NAVIGATIONAL,INFORMATIONAL,TOFU,LOW,LOW,NONE,FALSE,IRRELEVANT_ENTITY_OR_BRAND
games you can play virtual,IRRELEVANT_OR_NAVIGATIONAL,INFORMATIONAL,TOFU,LOW,LOW,NONE,FALSE,NOT_RELEVANT_TO_PRODUCT_OFFER
virtual labs govt of india,IRRELEVANT_OR_NAVIGATIONAL,NAVIGATIONAL,TOFU,LOW,LOW,NONE,FALSE,IRRELEVANT_ENTITY_OR_BRAND
cyber security jobs in uae,CYBERSECURITY_CAREER,COMMERCIAL,TOFU,MEDIUM,MEDIUM,PILLAR_BLOG_PAGE,TRUE,
what is hands on learning,IRRELEVANT_OR_NAVIGATIONAL,INFORMATIONAL,TOFU,LOW,LOW,NONE,FALSE,NOT_RELEVANT_TO_PRODUCT_OFFER
what is hands on teaching,IRRELEVANT_OR_NAVIGATIONAL,INFORMATIONAL,TOFU,LOW,LOW,NONE,FALSE,NOT_RELEVANT_TO_PRODUCT_OFFER
cyber range hood 1200 cfm,IRRELEVANT_OR_NAVIGATIONAL,COMMERCIAL,MOFU,LOW,LOW,NONE,FALSE,IRRELEVANT_ENTITY_OR_BRAND
virtual labs by iit delhi,IRRELEVANT_OR_NAVIGATIONAL,NAVIGATIONAL,TOFU,LOW,LOW,NONE,FALSE,IRRELEVANT_ENTITY_OR_BRAND
how do virtual labs work,CYBER_LAB_SETUP,INFORMATIONAL,TOFU,MEDIUM,LOW,PILLAR_BLOG_PAGE,TRUE,
cyber range hack the box,IRRELEVANT_OR_NAVIGATIONAL,NAVIGATIONAL,TOFU,LOW,LOW,NONE,FALSE,IRRELEVANT_ENTITY_OR_BRAND
hitcon cyber range x ctf,IRRELEVANT_OR_NAVIGATIONAL,NAVIGATIONAL,TOFU,LOW,LOW,NONE,FALSE,IRRELEVANT_ENTITY_OR_BRAND
virtual lab jk flip flop,IRRELEVANT_OR_NAVIGATIONAL,INFORMATIONAL,TOFU,LOW,LOW,NONE,FALSE,IRRELEVANT_ENTITY_OR_BRAND
virtual labs kvl and kcl,IRRELEVANT_OR_NAVIGATIONAL,INFORMATIONAL,TOFU,LOW,LOW,NONE,FALSE,IRRELEVANT_ENTITY_OR_BRAND
lab zero games shut down,IRRELEVANT_OR_NAVIGATIONAL,INFORMATIONAL,TOFU,LOW,LOW,NONE,FALSE,IRRELEVANT_ENTITY_OR_BRAND
cyber hub vs cyber city,IRRELEVANT_OR_NAVIGATIONAL,INFORMATIONAL,TOFU,LOW,LOW,NONE,FALSE,IRRELEVANT_ENTITY_OR_BRAND
cyber exercise in a box,CTF_BASICS,INFORMATIONAL,TOFU,MEDIUM,LOW,PILLAR_BLOG_PAGE,TRUE,
virtual labs vlab co in,IRRELEVANT_OR_NAVIGATIONAL,NAVIGATIONAL,TOFU,LOW,LOW,NONE,FALSE,IRRELEVANT_ENTITY_OR_BRAND
what is a cyber range,CTF_BASICS,INFORMATIONAL,TOFU,MEDIUM,LOW,PILLAR_BLOG_PAGE,TRUE,
cyber range in a box,CTF_BASICS,INFORMATIONAL,TOFU,MEDIUM,LOW,PILLAR_BLOG_PAGE,TRUE,
cyber range sp z oo,IRRELEVANT_OR_NAVIGATIONAL,NAVIGATIONAL,TOFU,LOW,LOW,NONE,FALSE,IRRELEVANT_ENTITY_OR_BRAND
how to host a ctf,CTF_HOSTING,INFORMATIONAL,MOFU,HIGH,HIGH,USE_CASE_PAGE,TRUE,
cybersecurity operational readiness assessment,CYBER_LAB_LEARNING,INFORMATIONAL,MOFU,HIGH,MEDIUM,PILLAR_BLOG_PAGE,TRUE,
cybersecurity incident simulation exercises,CYBER_LAB_LEARNING,INFORMATIONAL,MOFU,HIGH,MEDIUM,PILLAR_BLOG_PAGE,TRUE,
cybersecurity interactive simulation system,CYBER_LAB_SETUP,INFORMATIONAL,MOFU,HIGH,MEDIUM,PILLAR_BLOG_PAGE,TRUE,
cybersecurity maturity model certification,CYBERSECURITY_CAREER,INFORMATIONAL,MOFU,MEDIUM,MEDIUM,PILLAR_BLOG_PAGE,TRUE,
cybersecurity awareness training software,CYBER_LAB_REQUIREMENTS,COMMERCIAL,BOFU,HIGH,MEDIUM,PILLAR_BLOG_PAGE,TRUE,
cybersecurity awareness training platform,CYBER_LAB_REQUIREMENTS,COMMERCIAL,BOFU,HIGH,MEDIUM,PILLAR_BLOG_PAGE,TRUE,
virtual experiments simulations praxilabs,IRRELEVANT_OR_NAVIGATIONAL,NAVIGATIONAL,TOFU,LOW,LOW,NONE,FALSE,IRRELEVANT_ENTITY_OR_BRAND
cybersecurity training harvard university,ACADEMIC_LAB_MANUALS,INFORMATIONAL,TOFU,LOW,LOW,PILLAR_BLOG_PAGE,FALSE,ACADEMIC_SYLLABUS_NO_COMMERCIAL_VALUE
cybersecurity enterprise risk management,CYBERSECURITY_CAREER,INFORMATIONAL,MOFU,MEDIUM,MEDIUM,PILLAR_BLOG_PAGE,TRUE,
airbus cybersecurity simulation platform,IRRELEVANT_OR_NAVIGATIONAL,NAVIGATIONAL,TOFU,LOW,LOW,NONE,FALSE,IRRELEVANT_ENTITY_OR_BRAND
cybersecurity training and certification,CYBERSECURITY_CAREER,INFORMATIONAL,MOFU,MEDIUM,MEDIUM,PILLAR_BLOG_PAGE,TRUE,
lab simulation biological macromolecules,IRRELEVANT_OR_NAVIGATIONAL,INFORMATIONAL,TOFU,LOW,LOW,NONE,FALSE,IRRELEVANT_ENTITY_OR_BRAND
cybersecurity job simulation certificate,CYBERSECURITY_CAREER,INFORMATIONAL,MOFU,MEDIUM,MEDIUM,PILLAR_BLOG_PAGE,TRUE,
virtual radiography simulation software,IRRELEVANT_OR_NAVIGATIONAL,INFORMATIONAL,TOFU,LOW,LOW,NONE,FALSE,IRRELEVANT_ENTITY_OR_BRAND
cybersecurity software developer salary,CYBERSECURITY_CAREER,INFORMATIONAL,TOFU,MEDIUM,MEDIUM,PILLAR_BLOG_PAGE,TRUE,
cybersecurity solutions for enterprises,CYBER_LAB_REQUIREMENTS,COMMERCIAL,BOFU,HIGH,MEDIUM,PILLAR_BLOG_PAGE,TRUE,
cybersecurity xbrl tagging requirements,IRRELEVANT_OR_NAVIGATIONAL,INFORMATIONAL,TOFU,LOW,LOW,NONE,FALSE,IRRELEVANT_ENTITY_OR_BRAND
cybersecurity job simulation mastercard,IRRELEVANT_OR_NAVIGATIONAL,NAVIGATIONAL,TOFU,LOW,LOW,NONE,FALSE,IRRELEVANT_ENTITY_OR_BRAND
cybersecurity training with certificate,CYBERSECURITY_CAREER,INFORMATIONAL,MOFU,MEDIUM,MEDIUM,PILLAR_BLOG_PAGE,TRUE,
cybersecurity software engineer salary,CYBERSECURITY_CAREER,INFORMATIONAL,TOFU,MEDIUM,MEDIUM,PILLAR_BLOG_PAGE,TRUE,
cybersecurity universities in pakistan,ACADEMIC_LAB_MANUALS,INFORMATIONAL,TOFU,LOW,LOW,NONE,FALSE,ACADEMIC_SYLLABUS_NO_COMMERCIAL_VALUE
cybersecurity open source intelligence,CYBER_LAB_LEARNING,INFORMATIONAL,MOFU,MEDIUM,MEDIUM,PILLAR_BLOG_PAGE,TRUE,
cybersecurity awareness training price,CYBER_LAB_LEARNING,COMMERCIAL,BOFU,HIGH,MEDIUM,PILLAR_BLOG_PAGE,TRUE,
cybersecurity training programs online,CYBERSECURITY_CAREER,INFORMATIONAL,MOFU,MEDIUM,MEDIUM,PILLAR_BLOG_PAGE,TRUE,
online cybersecurity training platform,CTF_PLATFORMS,COMMERCIAL,BOFU,HIGH,HIGH,CORE_PRODUCT_PAGE,TRUE,
cybersecurity powerpoint template free,IRRELEVANT_OR_NAVIGATIONAL,INFORMATIONAL,TOFU,LOW,LOW,NONE,FALSE,NOT_RELEVANT_TO_PRODUCT_OFFER
cybersecurity simulation training free,CTF_PLATFORMS,COMMERCIAL,BOFU,HIGH,HIGH,COMPARISON_PAGE,TRUE,
cybersecurity training with internship,CYBERSECURITY_CAREER,INFORMATIONAL,MOFU,MEDIUM,MEDIUM,PILLAR_BLOG_PAGE,TRUE,
virtual radiation simulation software,IRRELEVANT_OR_NAVIGATIONAL,INFORMATIONAL,TOFU,LOW,LOW,NONE,FALSE,NOT_RELEVANT_TO_PRODUCT_OFFER
cybersecurity universities in germany,ACADEMIC_LAB_MANUALS,INFORMATIONAL,TOFU,LOW,LOW,NONE,FALSE,ACADEMIC_SYLLABUS_NO_COMMERCIAL_VALUE
cybersecurity for students letsdefend,IRRELEVANT_OR_NAVIGATIONAL,NAVIGATIONAL,TOFU,LOW,LOW,NONE,FALSE,IRRELEVANT_ENTITY_OR_BRAND
cybersecurity vs software engineering,CYBERSECURITY_CAREER,INFORMATIONAL,TOFU,MEDIUM,MEDIUM,PILLAR_BLOG_PAGE,TRUE,
cybersecurity vs information security,CYBERSECURITY_CAREER,INFORMATIONAL,TOFU,MEDIUM,MEDIUM,PILLAR_BLOG_PAGE,TRUE,
cybersecurity training best practices,CYBER_LAB_LEARNING,INFORMATIONAL,MOFU,HIGH,MEDIUM,PILLAR_BLOG_PAGE,TRUE,
best cybersecurity training platforms,CTF_PLATFORMS,COMMERCIAL,BOFU,HIGH,HIGH,COMPARISON_PAGE,TRUE,
free cybersecurity training platforms,CTF_PLATFORMS,COMMERCIAL,BOFU,HIGH,HIGH,COMPARISON_PAGE,TRUE,
cybersecurity training lagos students,CYBER_LAB_LEARNING,INFORMATIONAL,TOFU,LOW,LOW,NONE,FALSE,NOT_RELEVANT_TO_PRODUCT_OFFER
cybersecurity training for businesses,CYBER_LAB_LEARNING,COMMERCIAL,BOFU,HIGH,MEDIUM,PILLAR_BLOG_PAGE,TRUE,
cybersecurity training and internship,CYBERSECURITY_CAREER,INFORMATIONAL,MOFU,MEDIUM,MEDIUM,PILLAR_BLOG_PAGE,TRUE,
hostile environment security training,CYBER_LAB_LEARNING,INFORMATIONAL,MOFU,MEDIUM,MEDIUM,PILLAR_BLOG_PAGE,TRUE,
cybersecurity questions for interview,SOC_AND_INTERVIEW,INFORMATIONAL,TOFU,LOW,MEDIUM,PILLAR_BLOG_PAGE,FALSE,NOT_RELEVANT_TO_PRODUCT_OFFER
cybersecurity zero trust architecture,CYBER_LAB_LEARNING,INFORMATIONAL,MOFU,HIGH,MEDIUM,PILLAR_BLOG_PAGE,TRUE,
simulation lab electrical engineering,IRRELEVANT_OR_NAVIGATIONAL,INFORMATIONAL,TOFU,LOW,LOW,NONE,FALSE,NOT_RELEVANT_TO_PRODUCT_OFFER
cyber security training qualification,CYBERSECURITY_CAREER,INFORMATIONAL,MOFU,MEDIUM,MEDIUM,PILLAR_BLOG_PAGE,TRUE,
cybersecurity training with placement,CYBERSECURITY_CAREER,INFORMATIONAL,MOFU,MEDIUM,MEDIUM,PILLAR_BLOG_PAGE,TRUE,
cybersecurity software engineer jobs,CYBERSECURITY_CAREER,INFORMATIONAL,TOFU,MEDIUM,MEDIUM,PILLAR_BLOG_PAGE,TRUE,
cybersecurity platforms for learning,CTF_PLATFORMS,COMMERCIAL,BOFU,HIGH,HIGH,CORE_PRODUCT_PAGE,TRUE,
cybersecurity awareness for students,CYBER_LAB_LEARNING,INFORMATIONAL,TOFU,LOW,LOW,PILLAR_BLOG_PAGE,FALSE,NOT_RELEVANT_TO_PRODUCT_OFFER
cybersecurity training for employees,CYBER_LAB_LEARNING,COMMERCIAL,MOFU,HIGH,MEDIUM,PILLAR_BLOG_PAGE,TRUE,
cybersecurity training and placement,CYBERSECURITY_CAREER,COMMERCIAL,MOFU,MEDIUM,MEDIUM,PILLAR_BLOG_PAGE,TRUE,
cybersecurity training programs free,CYBER_LAB_LEARNING,INFORMATIONAL,TOFU,LOW,LOW,PILLAR_BLOG_PAGE,FALSE,NOT_RELEVANT_TO_PRODUCT_OFFER
cybersecurity training program kenya,CYBER_LAB_LEARNING,COMMERCIAL,MOFU,MEDIUM,MEDIUM,PILLAR_BLOG_PAGE,TRUE,
cisa cybersecurity training platform,IRRELEVANT_OR_NAVIGATIONAL,NAVIGATIONAL,TOFU,LOW,LOW,NONE,FALSE,IRRELEVANT_ENTITY_OR_BRAND
cybersecurity training for companies,CYBER_LAB_LEARNING,COMMERCIAL,MOFU,HIGH,MEDIUM,PILLAR_BLOG_PAGE,TRUE,
enterprise security vs cybersecurity,CYBER_LAB_LEARNING,INFORMATIONAL,TOFU,HIGH,MEDIUM,PILLAR_BLOG_PAGE,TRUE,
cybersecurity training and awareness,CYBER_LAB_LEARNING,COMMERCIAL,MOFU,HIGH,MEDIUM,PILLAR_BLOG_PAGE,TRUE,
virtual simulation medical education,IRRELEVANT_OR_NAVIGATIONAL,INFORMATIONAL,TOFU,LOW,LOW,NONE,FALSE,NOT_RELEVANT_TO_PRODUCT_OFFER
virtual simulation nursing education,IRRELEVANT_OR_NAVIGATIONAL,INFORMATIONAL,TOFU,LOW,LOW,NONE,FALSE,NOT_RELEVANT_TO_PRODUCT_OFFER
virtual lab geotechnical engineering,IRRELEVANT_OR_NAVIGATIONAL,INFORMATIONAL,TOFU,LOW,LOW,NONE,FALSE,NOT_RELEVANT_TO_PRODUCT_OFFER
cyber security degree apprenticeship,CYBERSECURITY_CAREER,INFORMATIONAL,TOFU,MEDIUM,MEDIUM,PILLAR_BLOG_PAGE,TRUE,
cyber security consulting simulation,CYBER_LAB_LEARNING,COMMERCIAL,MOFU,HIGH,MEDIUM,PILLAR_BLOG_PAGE,TRUE,
cybersecurity job simulation meaning,CYBERSECURITY_CAREER,INFORMATIONAL,TOFU,MEDIUM,MEDIUM,PILLAR_BLOG_PAGE,TRUE,
cybersecurity training by government,CYBER_LAB_LEARNING,INFORMATIONAL,TOFU,MEDIUM,MEDIUM,PILLAR_BLOG_PAGE,TRUE,
cybersecurity training job placement,CYBERSECURITY_CAREER,COMMERCIAL,MOFU,MEDIUM,MEDIUM,PILLAR_BLOG_PAGE,TRUE,
cybersecurity training job guarantee,CYBERSECURITY_CAREER,COMMERCIAL,MOFU,MEDIUM,MEDIUM,PILLAR_BLOG_PAGE,TRUE,
cyber security training johannesburg,CYBER_LAB_LEARNING,COMMERCIAL,MOFU,MEDIUM,MEDIUM,PILLAR_BLOG_PAGE,TRUE,
cybersecurity training washington dc,CYBER_LAB_LEARNING,COMMERCIAL,MOFU,MEDIUM,MEDIUM,PILLAR_BLOG_PAGE,TRUE,
free cybersecurity training zimbabwe,CYBER_LAB_LEARNING,INFORMATIONAL,TOFU,LOW,LOW,PILLAR_BLOG_PAGE,FALSE,NOT_RELEVANT_TO_PRODUCT_OFFER
virtual business simulation answers,IRRELEVANT_OR_NAVIGATIONAL,INFORMATIONAL,TOFU,LOW,LOW,NONE,FALSE,NOT_RELEVANT_TO_PRODUCT_OFFER
virtual network simulation software,CYBER_LAB_REQUIREMENTS,COMMERCIAL,MOFU,HIGH,MEDIUM,PILLAR_BLOG_PAGE,TRUE,
virtual reality simulation software,IRRELEVANT_OR_NAVIGATIONAL,INFORMATIONAL,TOFU,LOW,LOW,NONE,FALSE,NOT_RELEVANT_TO_PRODUCT_OFFER
cybersecurity projects for students,CYBER_LAB_LEARNING,INFORMATIONAL,TOFU,LOW,LOW,PILLAR_BLOG_PAGE,FALSE,NOT_RELEVANT_TO_PRODUCT_OFFER
cybersecurity articles for students,CYBER_LAB_LEARNING,INFORMATIONAL,TOFU,LOW,LOW,PILLAR_BLOG_PAGE,FALSE,NOT_RELEVANT_TO_PRODUCT_OFFER
cybersecurity open source community,CYBER_LAB_REQUIREMENTS,INFORMATIONAL,TOFU,MEDIUM,MEDIUM,PILLAR_BLOG_PAGE,TRUE,
cybersecurity training in hyderabad,CYBER_LAB_LEARNING,COMMERCIAL,MOFU,MEDIUM,MEDIUM,PILLAR_BLOG_PAGE,TRUE,
cybersecurity training for students,CYBER_LAB_LEARNING,INFORMATIONAL,TOFU,LOW,LOW,PILLAR_BLOG_PAGE,FALSE,NOT_RELEVANT_TO_PRODUCT_OFFER
virtual reality simulations meaning,IRRELEVANT_OR_NAVIGATIONAL,INFORMATIONAL,TOFU,LOW,LOW,NONE,FALSE,NOT_RELEVANT_TO_PRODUCT_OFFER
virtual labs electrical engineering,IRRELEVANT_OR_NAVIGATIONAL,INFORMATIONAL,TOFU,LOW,LOW,NONE,FALSE,NOT_RELEVANT_TO_PRODUCT_OFFER
virtual labs mechanical engineering,IRRELEVANT_OR_NAVIGATIONAL,INFORMATIONAL,TOFU,LOW,LOW,NONE,FALSE,NOT_RELEVANT_TO_PRODUCT_OFFER
cybersecurity questions and answers,SOC_AND_INTERVIEW,INFORMATIONAL,TOFU,LOW,LOW,PILLAR_BLOG_PAGE,FALSE,NOT_RELEVANT_TO_PRODUCT_OFFER
cybersecurity job simulation forage,CYBERSECURITY_CAREER,INFORMATIONAL,TOFU,MEDIUM,MEDIUM,PILLAR_BLOG_PAGE,TRUE,
cybersecurity training black friday,CYBER_LAB_LEARNING,COMMERCIAL,BOFU,MEDIUM,MEDIUM,PILLAR_BLOG_PAGE,TRUE,
cybersecurity training doesn't work,CYBER_LAB_LEARNING,INFORMATIONAL,TOFU,MEDIUM,MEDIUM,PILLAR_BLOG_PAGE,TRUE,
cybersecurity training for veterans,CYBER_LAB_LEARNING,INFORMATIONAL,TOFU,MEDIUM,MEDIUM,PILLAR_BLOG_PAGE,TRUE,
cybersecurity training for teachers,CYBER_LAB_LEARNING,INFORMATIONAL,TOFU,MEDIUM,MEDIUM,PILLAR_BLOG_PAGE,TRUE,
cybersecurity training in bangalore,CYBER_LAB_LEARNING,COMMERCIAL,MOFU,MEDIUM,MEDIUM,PILLAR_BLOG_PAGE,TRUE,
cybersecurity training online india,CYBER_LAB_LEARNING,COMMERCIAL,MOFU,MEDIUM,MEDIUM,PILLAR_BLOG_PAGE,TRUE,
cybersecurity training quiz answers,CYBER_LAB_LEARNING,INFORMATIONAL,TOFU,LOW,LOW,PILLAR_BLOG_PAGE,FALSE,NOT_RELEVANT_TO_PRODUCT_OFFER
cybersecurity training south africa,CYBER_LAB_LEARNING,COMMERCIAL,MOFU,MEDIUM,MEDIUM,PILLAR_BLOG_PAGE,TRUE,
free cybersecurity training youtube,CYBER_LAB_LEARNING,INFORMATIONAL,TOFU,LOW,LOW,PILLAR_BLOG_PAGE,FALSE,NOT_RELEVANT_TO_PRODUCT_OFFER
virtual software modeling engineer,IRRELEVANT_OR_NAVIGATIONAL,INFORMATIONAL,TOFU,LOW,LOW,NONE,FALSE,NOT_RELEVANT_TO_PRODUCT_OFFER
cybersecurity open source projects,CYBER_LAB_REQUIREMENTS,INFORMATIONAL,TOFU,MEDIUM,MEDIUM,PILLAR_BLOG_PAGE,TRUE,
cybersecurity open source software,CYBER_LAB_REQUIREMENTS,INFORMATIONAL,TOFU,MEDIUM,MEDIUM,PILLAR_BLOG_PAGE,TRUE,
cybersecurity training for schools,CYBER_LAB_LEARNING,INFORMATIONAL,TOFU,MEDIUM,MEDIUM,PILLAR_BLOG_PAGE,TRUE,
cyber security technology examples,CYBER_LAB_REQUIREMENTS,INFORMATIONAL,TOFU,MEDIUM,MEDIUM,PILLAR_BLOG_PAGE,TRUE,
training cyber threat intelligence,CYBER_LAB_LEARNING,INFORMATIONAL,TOFU,MEDIUM,MEDIUM,PILLAR_BLOG_PAGE,TRUE,
cyber virtual training environment,CYBER_LAB_SETUP,INFORMATIONAL,TOFU,HIGH,MEDIUM,PILLAR_BLOG_PAGE,TRUE,
virtual simulation in radiotherapy,IRRELEVANT_OR_NAVIGATIONAL,INFORMATIONAL,TOFU,LOW,LOW,NONE,FALSE,NOT_RELEVANT_TO_PRODUCT_OFFER
virtual labs microwave engineering,IRRELEVANT_OR_NAVIGATIONAL,INFORMATIONAL,TOFU,LOW,LOW,NONE,FALSE,NOT_RELEVANT_TO_PRODUCT_OFFER
virtual lab simulation electronics,IRRELEVANT_OR_NAVIGATIONAL,INFORMATIONAL,TOFU,LOW,LOW,NONE,FALSE,NOT_RELEVANT_TO_PRODUCT_OFFER
virtual lab homeostasis simulation,IRRELEVANT_OR_NAVIGATIONAL,INFORMATIONAL,TOFU,LOW,LOW,NONE,FALSE,NOT_RELEVANT_TO_PRODUCT_OFFER
labxchange virtual lab simulations,IRRELEVANT_OR_NAVIGATIONAL,NAVIGATIONAL,TOFU,LOW,LOW,NONE,FALSE,IRRELEVANT_ENTITY_OR_BRAND
cybersecurity training course free,CYBER_LAB_LEARNING,INFORMATIONAL,TOFU,LOW,LOW,PILLAR_BLOG_PAGE,FALSE,NOT_RELEVANT_TO_PRODUCT_OFFER
cybersecurity training for seniors,CYBER_LAB_LEARNING,INFORMATIONAL,TOFU,MEDIUM,MEDIUM,PILLAR_BLOG_PAGE,TRUE,
cybersecurity training for elderly,CYBER_LAB_LEARNING,INFORMATIONAL,TOFU,MEDIUM,MEDIUM,PILLAR_BLOG_PAGE,TRUE,
cybersecurity training free online,CYBER_LAB_LEARNING,INFORMATIONAL,TOFU,LOW,LOW,PILLAR_BLOG_PAGE,FALSE,NOT_RELEVANT_TO_PRODUCT_OFFER
cybersecurity training jobs remote,CYBERSECURITY_CAREER,INFORMATIONAL,TOFU,MEDIUM,MEDIUM,PILLAR_BLOG_PAGE,TRUE,
cybersecurity training online free,CYBER_LAB_LEARNING,INFORMATIONAL,TOFU,LOW,LOW,NONE,FALSE,NOT_RELEVANT_TO_PRODUCT_OFFER
cybersecurity training san antonio,IRRELEVANT_OR_NAVIGATIONAL,NAVIGATIONAL,TOFU,LOW,LOW,NONE,FALSE,LOCAL_SERVICE_INTENT_NEAR_ME
cybersecurity training videos free,CYBER_LAB_LEARNING,INFORMATIONAL,TOFU,LOW,LOW,NONE,FALSE,NOT_RELEVANT_TO_PRODUCT_OFFER
virtual labs software engineering,IRRELEVANT_OR_NAVIGATIONAL,INFORMATIONAL,TOFU,LOW,LOW,NONE,FALSE,NOT_RELEVANT_TO_PRODUCT_OFFER
arctic wolf cybersecurity pricing,IRRELEVANT_OR_NAVIGATIONAL,COMMERCIAL,MOFU,LOW,LOW,NONE,FALSE,IRRELEVANT_ENTITY_OR_BRAND
cybersecurity universities in uae,CYBERSECURITY_CAREER,INFORMATIONAL,TOFU,MEDIUM,MEDIUM,PILLAR_BLOG_PAGE,TRUE,
cyber security university ranking,CYBERSECURITY_CAREER,INFORMATIONAL,TOFU,MEDIUM,MEDIUM,PILLAR_BLOG_PAGE,TRUE,
cybersecurity vs computer science,CYBERSECURITY_CAREER,INFORMATIONAL,TOFU,MEDIUM,MEDIUM,PILLAR_BLOG_PAGE,TRUE,
chemistry lab simulation software,IRRELEVANT_OR_NAVIGATIONAL,COMMERCIAL,MOFU,LOW,LOW,NONE,FALSE,NOT_RELEVANT_TO_PRODUCT_OFFER
cyber security assessment answers,CYBER_LAB_LEARNING,INFORMATIONAL,TOFU,LOW,LOW,NONE,FALSE,NOT_RELEVANT_TO_PRODUCT_OFFER
cyber security software companies,CYBER_LAB_REQUIREMENTS,COMMERCIAL,MOFU,MEDIUM,MEDIUM,PILLAR_BLOG_PAGE,TRUE,
cyber security training companies,CYBER_LAB_REQUIREMENTS,COMMERCIAL,MOFU,MEDIUM,MEDIUM,PILLAR_BLOG_PAGE,TRUE,
cyber training login www.army.mil,IRRELEVANT_OR_NAVIGATIONAL,NAVIGATIONAL,TOFU,LOW,LOW,NONE,FALSE,IRRELEVANT_ENTITY_OR_BRAND
virtual simulation based learning,CYBER_LAB_LEARNING,INFORMATIONAL,TOFU,MEDIUM,MEDIUM,PILLAR_BLOG_PAGE,TRUE,
virtual simulation kit phlebotomy,IRRELEVANT_OR_NAVIGATIONAL,COMMERCIAL,MOFU,LOW,LOW,NONE,FALSE,NOT_RELEVANT_TO_PRODUCT_OFFER
virtual simulation learning tools,CYBER_LAB_REQUIREMENTS,COMMERCIAL,MOFU,MEDIUM,MEDIUM,PILLAR_BLOG_PAGE,TRUE,
virtual labs amplitude modulation,IRRELEVANT_OR_NAVIGATIONAL,INFORMATIONAL,TOFU,LOW,LOW,NONE,FALSE,NOT_RELEVANT_TO_PRODUCT_OFFER
cybersecurity books for beginners,CYBER_LAB_LEARNING,INFORMATIONAL,TOFU,LOW,LOW,NONE,FALSE,NOT_RELEVANT_TO_PRODUCT_OFFER
cybersecurity online courses free,CYBER_LAB_LEARNING,INFORMATIONAL,TOFU,LOW,LOW,NONE,FALSE,NOT_RELEVANT_TO_PRODUCT_OFFER
simulation lab coordinator salary,IRRELEVANT_OR_NAVIGATIONAL,INFORMATIONAL,TOFU,LOW,LOW,NONE,FALSE,NOT_RELEVANT_TO_PRODUCT_OFFER
simulation lab internship stipend,IRRELEVANT_OR_NAVIGATIONAL,INFORMATIONAL,TOFU,LOW,LOW,NONE,FALSE,NOT_RELEVANT_TO_PRODUCT_OFFER
simulation lab nursing instructor,IRRELEVANT_OR_NAVIGATIONAL,INFORMATIONAL,TOFU,LOW,LOW,NONE,FALSE,NOT_RELEVANT_TO_PRODUCT_OFFER
cybersecurity career simulation 1,CYBERSECURITY_CAREER,INFORMATIONAL,TOFU,MEDIUM,MEDIUM,PILLAR_BLOG_PAGE,TRUE,
cybersecurity career simulation 2,CYBERSECURITY_CAREER,INFORMATIONAL,TOFU,MEDIUM,MEDIUM,PILLAR_BLOG_PAGE,TRUE,
cybersecurity games for beginners,CYBER_LAB_LEARNING,INFORMATIONAL,TOFU,LOW,LOW,NONE,FALSE,NOT_RELEVANT_TO_PRODUCT_OFFER
cybersecurity games for employees,CYBER_LAB_LEARNING,INFORMATIONAL,TOFU,MEDIUM,MEDIUM,PILLAR_BLOG_PAGE,TRUE,
hands on primary/education centre,IRRELEVANT_OR_NAVIGATIONAL,NAVIGATIONAL,TOFU,LOW,LOW,NONE,FALSE,NOT_RELEVANT_TO_PRODUCT_OFFER
cybersecurity training in chennai,IRRELEVANT_OR_NAVIGATIONAL,NAVIGATIONAL,TOFU,LOW,LOW,NONE,FALSE,LOCAL_SERVICE_INTENT_NEAR_ME
cybersecurity training in nigeria,IRRELEVANT_OR_NAVIGATIONAL,NAVIGATIONAL,TOFU,LOW,LOW,NONE,FALSE,LOCAL_SERVICE_INTENT_NEAR_ME
cyber security training tryhackme,CTF_PLATFORMS,COMMERCIAL,MOFU,HIGH,HIGH,COMPARISON_PAGE,TRUE,
cybersecurity training uw madison,ACADEMIC_LAB_MANUALS,INFORMATIONAL,TOFU,LOW,LOW,NONE,FALSE,ACADEMIC_SYLLABUS_NO_COMMERCIAL_VALUE
cyber security training vancouver,IRRELEVANT_OR_NAVIGATIONAL,NAVIGATIONAL,TOFU,LOW,LOW,NONE,FALSE,LOCAL_SERVICE_INTENT_NEAR_ME
virtual shooting simulator price,IRRELEVANT_OR_NAVIGATIONAL,COMMERCIAL,MOFU,LOW,LOW,NONE,FALSE,NOT_RELEVANT_TO_PRODUCT_OFFER
online lab simulations chemistry,IRRELEVANT_OR_NAVIGATIONAL,INFORMATIONAL,TOFU,LOW,LOW,NONE,FALSE,NOT_RELEVANT_TO_PRODUCT_OFFER
virtual lab simulation chemistry,IRRELEVANT_OR_NAVIGATIONAL,INFORMATIONAL,TOFU,LOW,LOW,NONE,FALSE,NOT_RELEVANT_TO_PRODUCT_OFFER
cybersecurity open source github,CTF_PLATFORMS,INFORMATIONAL,MOFU,MEDIUM,HIGH,COMPARISON_PAGE,TRUE,
cybersecurity games for students,CYBER_LAB_LEARNING,INFORMATIONAL,TOFU,LOW,LOW,NONE,FALSE,NOT_RELEVANT_TO_PRODUCT_OFFER
cybersecurity best course reddit,CYBERSECURITY_CAREER,INFORMATIONAL,TOFU,MEDIUM,MEDIUM,PILLAR_BLOG_PAGE,TRUE,
cybersecurity best course online,CYBERSECURITY_CAREER,COMMERCIAL,MOFU,MEDIUM,MEDIUM,PILLAR_BLOG_PAGE,TRUE,
cyber security training examples,CYBER_LAB_LEARNING,INFORMATIONAL,TOFU,MEDIUM,LOW,PILLAR_BLOG_PAGE,TRUE,
what is enterprise cybersecurity,CYBER_LAB_SETUP,INFORMATIONAL,TOFU,HIGH,MEDIUM,PILLAR_BLOG_PAGE,TRUE,
cyber awareness training quizlet,CYBER_LAB_LEARNING,INFORMATIONAL,TOFU,LOW,LOW,NONE,FALSE,NOT_RELEVANT_TO_PRODUCT_OFFER
cyber essentials training course,CYBER_LAB_LEARNING,COMMERCIAL,MOFU,MEDIUM,LOW,PILLAR_BLOG_PAGE,TRUE,
cyber tabletop exercise examples,CYBER_LAB_LEARNING,INFORMATIONAL,TOFU,HIGH,LOW,PILLAR_BLOG_PAGE,TRUE,
virtual assistant simulator game,IRRELEVANT_OR_NAVIGATIONAL,INFORMATIONAL,TOFU,LOW,LOW,NONE,FALSE,NOT_RELEVANT_TO_PRODUCT_OFFER
virtual games betting prediction,IRRELEVANT_OR_NAVIGATIONAL,INFORMATIONAL,TOFU,LOW,LOW,NONE,FALSE,NOT_RELEVANT_TO_PRODUCT_OFFER
virtual boyfriend simulator xbox,IRRELEVANT_OR_NAVIGATIONAL,INFORMATIONAL,TOFU,LOW,LOW,NONE,FALSE,NOT_RELEVANT_TO_PRODUCT_OFFER
cyber range johannesburg reviews,CTF_PLATFORMS,COMMERCIAL,MOFU,HIGH,HIGH,COMPARISON_PAGE,TRUE,
virtual labs digital electronics,IRRELEVANT_OR_NAVIGATIONAL,INFORMATIONAL,TOFU,LOW,LOW,NONE,FALSE,NOT_RELEVANT_TO_PRODUCT_OFFER
virtual lab qualitative analysis,IRRELEVANT_OR_NAVIGATIONAL,INFORMATIONAL,TOFU,LOW,LOW,NONE,FALSE,NOT_RELEVANT_TO_PRODUCT_OFFER
virtual labs universidad europea,ACADEMIC_LAB_MANUALS,INFORMATIONAL,TOFU,LOW,LOW,NONE,FALSE,ACADEMIC_SYLLABUS_NO_COMMERCIAL_VALUE
virtual hacking labs walkthrough,CYBER_LAB_LEARNING,INFORMATIONAL,TOFU,MEDIUM,LOW,PILLAR_BLOG_PAGE,TRUE,
cybersecurity companies in egypt,IRRELEVANT_OR_NAVIGATIONAL,NAVIGATIONAL,TOFU,LOW,LOW,NONE,FALSE,LOCAL_SERVICE_INTENT_NEAR_ME
cybersecurity entry level salary,CYBERSECURITY_CAREER,INFORMATIONAL,TOFU,MEDIUM,MEDIUM,PILLAR_BLOG_PAGE,TRUE,
interactive lab simulation azure,CYBER_LAB_SETUP,INFORMATIONAL,TOFU,HIGH,MEDIUM,PILLAR_BLOG_PAGE,TRUE,
simulation lab internship review,CYBER_LAB_LEARNING,INFORMATIONAL,TOFU,LOW,LOW,NONE,FALSE,NOT_RELEVANT_TO_PRODUCT_OFFER
simulation lab technician salary,IRRELEVANT_OR_NAVIGATIONAL,INFORMATIONAL,TOFU,LOW,LOW,NONE,FALSE,NOT_RELEVANT_TO_PRODUCT_OFFER
lab simulation molecular cloning,IRRELEVANT_OR_NAVIGATIONAL,INFORMATIONAL,TOFU,LOW,LOW,NONE,FALSE,NOT_RELEVANT_TO_PRODUCT_OFFER
simulation lab nursing scenarios,IRRELEVANT_OR_NAVIGATIONAL,INFORMATIONAL,TOFU,LOW,LOW,NONE,FALSE,NOT_RELEVANT_TO_PRODUCT_OFFER
lab rats simulation manipulation,IRRELEVANT_OR_NAVIGATIONAL,INFORMATIONAL,TOFU,LOW,LOW,NONE,FALSE,NOT_RELEVANT_TO_PRODUCT_OFFER
cyber security analyst simulator,CTF_PLATFORMS,COMMERCIAL,MOFU,HIGH,HIGH,CORE_PRODUCT_PAGE,TRUE,
cybersecurity games for learning,CTF_BASICS,INFORMATIONAL,TOFU,MEDIUM,LOW,PILLAR_BLOG_PAGE,TRUE,
cybersecurity training by google,IRRELEVANT_OR_NAVIGATIONAL,NAVIGATIONAL,TOFU,LOW,LOW,NONE,FALSE,IRRELEVANT_ENTITY_OR_BRAND
cybersecurity training in europe,CYBERSECURITY_CAREER,INFORMATIONAL,TOFU,MEDIUM,MEDIUM,PILLAR_BLOG_PAGE,TRUE,
cybersecurity training for teens,CYBER_LAB_LEARNING,INFORMATIONAL,TOFU,LOW,LOW,NONE,FALSE,NOT_RELEVANT_TO_PRODUCT_OFFER
cybersecurity training hong kong,CYBERSECURITY_CAREER,INFORMATIONAL,TOFU,MEDIUM,MEDIUM,PILLAR_BLOG_PAGE,TRUE,
cybersecurity training in ibadan,CYBERSECURITY_CAREER,INFORMATIONAL,TOFU,MEDIUM,MEDIUM,PILLAR_BLOG_PAGE,TRUE,
cybersecurity training las vegas,CYBERSECURITY_CAREER,INFORMATIONAL,TOFU,MEDIUM,MEDIUM,PILLAR_BLOG_PAGE,TRUE,
cyber security training vadodara,CYBERSECURITY_CAREER,INFORMATIONAL,TOFU,MEDIUM,MEDIUM,PILLAR_BLOG_PAGE,TRUE,
cybersecurity training for youth,CYBER_LAB_LEARNING,INFORMATIONAL,TOFU,LOW,LOW,NONE,FALSE,NOT_RELEVANT_TO_PRODUCT_OFFER
virtual welding simulator price,IRRELEVANT_OR_NAVIGATIONAL,COMMERCIAL,MOFU,LOW,LOW,NONE,FALSE,NOT_RELEVANT_TO_PRODUCT_OFFER
virtual cricket simulator price,IRRELEVANT_OR_NAVIGATIONAL,COMMERCIAL,MOFU,LOW,LOW,NONE,FALSE,NOT_RELEVANT_TO_PRODUCT_OFFER
virtual reality simulator price,IRRELEVANT_OR_NAVIGATIONAL,COMMERCIAL,MOFU,LOW,LOW,NONE,FALSE,NOT_RELEVANT_TO_PRODUCT_OFFER
virtual driving simulator price,IRRELEVANT_OR_NAVIGATIONAL,COMMERCIAL,MOFU,LOW,LOW,NONE,FALSE,NOT_RELEVANT_TO_PRODUCT_OFFER
virtual lab simulation software,CYBER_LAB_SETUP,COMMERCIAL,MOFU,HIGH,MEDIUM,PILLAR_BLOG_PAGE,TRUE,
virtual golf simulator software,IRRELEVANT_OR_NAVIGATIONAL,COMMERCIAL,MOFU,LOW,LOW,NONE,FALSE,NOT_RELEVANT_TO_PRODUCT_OFFER
online simulations for students,CYBER_LAB_LEARNING,INFORMATIONAL,TOFU,LOW,LOW,NONE,FALSE,NOT_RELEVANT_TO_PRODUCT_OFFER
cyber range simulation platform,CTF_PLATFORMS,COMMERCIAL,MOFU,HIGH,HIGH,CORE_PRODUCT_PAGE,TRUE,
cybersecurity open source tools,CYBER_LAB_REQUIREMENTS,INFORMATIONAL,TOFU,MEDIUM,LOW,PILLAR_BLOG_PAGE,TRUE,
cybersecurity vs cloud security,CTF_PLATFORMS,INFORMATIONAL,TOFU,MEDIUM,HIGH,COMPARISON_PAGE,TRUE,
cybersecurity vs cyber security,CTF_PLATFORMS,INFORMATIONAL,TOFU,MEDIUM,HIGH,COMPARISON_PAGE,TRUE,
cybersecurity vs data analytics,CTF_PLATFORMS,INFORMATIONAL,TOFU,MEDIUM,HIGH,COMPARISON_PAGE,TRUE,
science lab simulation software,IRRELEVANT_OR_NAVIGATIONAL,COMMERCIAL,MOFU,LOW,LOW,NONE,FALSE,NOT_RELEVANT_TO_PRODUCT_OFFER
physics lab simulation software,IRRELEVANT_OR_NAVIGATIONAL,COMMERCIAL,MOFU,LOW,LOW,NONE,FALSE,NOT_RELEVANT_TO_PRODUCT_OFFER
cybersecurity training for kids,CYBER_LAB_LEARNING,INFORMATIONAL,TOFU,LOW,LOW,NONE,FALSE,NOT_RELEVANT_TO_PRODUCT_OFFER
