keyword,cluster,intent,funnel_stage,audience_fit,priority,page_type,keep,drop_reason
in cybersecurity simulations how are tools applied to respond to incidents,CTF_BASICS,INFORMATIONAL,TOFU,MEDIUM,LOW,PILLAR_BLOG_PAGE,TRUE,
virtual labs on diksha are aligned with which education policy,IRRELEVANT_OR_NAVIGATIONAL,NAVIGATIONAL,TOFU,LOW,LOW,NONE,FALSE,IRRELEVANT_ENTITY_OR_BRAND
how long does it take to train in cyber security,CYBERSECURITY_CAREER,INFORMATIONAL,TOFU,MEDIUM,MEDIUM,PILLAR_BLOG_PAGE,TRUE,
do you need to go to school for cyber security,CYBERSECURITY_CAREER,INFORMATIONAL,TOFU,MEDIUM,MEDIUM,PILLAR_BLOG_PAGE,TRUE,
do i need to go to college for cyber security,CYBERSECURITY_CAREER,INFORMATIONAL,TOFU,MEDIUM,MEDIUM,PILLAR_BLOG_PAGE,TRUE,
cybersecurity training for youth in west and central africa,CYBER_LAB_LEARNING,INFORMATIONAL,TOFU,LOW,LOW,NONE,FALSE,NOT_RELEVANT_TO_PRODUCT_OFFER
how much does it cost to learn cyber security,CYBERSECURITY_CAREER,INFORMATIONAL,TOFU,MEDIUM,MEDIUM,PILLAR_BLOG_PAGE,TRUE,
how long does it take to learn cyber security,CYBERSECURITY_CAREER,INFORMATIONAL,TOFU,MEDIUM,MEDIUM,PILLAR_BLOG_PAGE,TRUE,
cybersecurity training certification for state and local governments,CYBER_LAB_LEARNING,COMMERCIAL,MOFU,HIGH,MEDIUM,PILLAR_BLOG_PAGE,TRUE,
virtual labs simulate which stage of software development,CYBER_LAB_LEARNING,INFORMATIONAL,TOFU,MEDIUM,LOW,PILLAR_BLOG_PAGE,TRUE,
lab simulation mendelian inheritance from genes to traits,IRRELEVANT_OR_NAVIGATIONAL,NAVIGATIONAL,TOFU,LOW,LOW,NONE,FALSE,IRRELEVANT_ENTITY_OR_BRAND
hands on activities for teaching addition and subtraction,IRRELEVANT_OR_NAVIGATIONAL,NAVIGATIONAL,TOFU,LOW,LOW,NONE,FALSE,IRRELEVANT_ENTITY_OR_BRAND
online simulation lab roller coaster physics answer key,IRRELEVANT_OR_NAVIGATIONAL,NAVIGATIONAL,TOFU,LOW,LOW,NONE,FALSE,IRRELEVANT_ENTITY_OR_BRAND
labster virtual labs for universities and high schools,IRRELEVANT_OR_NAVIGATIONAL,NAVIGATIONAL,TOFU,LOW,LOW,NONE,FALSE,IRRELEVANT_ENTITY_OR_BRAND
hands on activities for teaching a synthesis essay,IRRELEVANT_OR_NAVIGATIONAL,NAVIGATIONAL,TOFU,LOW,LOW,NONE,FALSE,IRRELEVANT_ENTITY_OR_BRAND
hands on activities for teaching the solar system,IRRELEVANT_OR_NAVIGATIONAL,NAVIGATIONAL,TOFU,LOW,LOW,NONE,FALSE,IRRELEVANT_ENTITY_OR_BRAND
what certifications do i need for cyber security,CYBERSECURITY_CAREER,INFORMATIONAL,TOFU,MEDIUM,MEDIUM,PILLAR_BLOG_PAGE,TRUE,
which is the best university for cyber security,CYBERSECURITY_CAREER,INFORMATIONAL,TOFU,MEDIUM,MEDIUM,PILLAR_BLOG_PAGE,TRUE,
how many days required to learn cyber security,CYBERSECURITY_CAREER,INFORMATIONAL,TOFU,MEDIUM,MEDIUM,PILLAR_BLOG_PAGE,TRUE,
how can i get cybersecurity training for free,CYBER_LAB_LEARNING,INFORMATIONAL,TOFU,LOW,LOW,NONE,FALSE,NOT_RELEVANT_TO_PRODUCT_OFFER
the simulations in virtual lab are useful for,CYBER_LAB_LEARNING,INFORMATIONAL,TOFU,MEDIUM,LOW,PILLAR_BLOG_PAGE,TRUE,
cyber war drill revenge of the savage planet,IRRELEVANT_OR_NAVIGATIONAL,NAVIGATIONAL,TOFU,LOW,LOW,NONE,FALSE,IRRELEVANT_ENTITY_OR_BRAND
what education do i need for cyber security,CYBERSECURITY_CAREER,INFORMATIONAL,TOFU,MEDIUM,MEDIUM,PILLAR_BLOG_PAGE,TRUE,
what courses do you need for cyber security,CYBERSECURITY_CAREER,INFORMATIONAL,TOFU,MEDIUM,MEDIUM,PILLAR_BLOG_PAGE,TRUE,
virtual lab and simulation ka kya labh hai,CYBER_LAB_LEARNING,INFORMATIONAL,TOFU,MEDIUM,LOW,PILLAR_BLOG_PAGE,TRUE,
how much does a cyber security course cost,CYBERSECURITY_CAREER,INFORMATIONAL,TOFU,MEDIUM,MEDIUM,PILLAR_BLOG_PAGE,TRUE,
virtual labs or simulation ka kya labh hai,CYBER_LAB_LEARNING,INFORMATIONAL,TOFU,MEDIUM,LOW,PILLAR_BLOG_PAGE,TRUE,
should i go to college for cyber security,CYBERSECURITY_CAREER,INFORMATIONAL,TOFU,MEDIUM,MEDIUM,PILLAR_BLOG_PAGE,TRUE,
how much does it cost for cyber security,CYBERSECURITY_CAREER,INFORMATIONAL,TOFU,MEDIUM,MEDIUM,PILLAR_BLOG_PAGE,TRUE,
should i go to school for cyber security,CYBERSECURITY_CAREER,INFORMATIONAL,TOFU,MEDIUM,MEDIUM,PILLAR_BLOG_PAGE,TRUE,
can a teacher put their hands on you,IRRELEVANT_OR_NAVIGATIONAL,INFORMATIONAL,TOFU,LOW,LOW,NONE,FALSE,IRRELEVANT_ENTITY_OR_BRAND
virtual patient simulations for health professional education,IRRELEVANT_OR_NAVIGATIONAL,INFORMATIONAL,TOFU,LOW,LOW,NONE,FALSE,IRRELEVANT_ENTITY_OR_BRAND
cybersecurity training and work integrated learning program,CYBER_LAB_LEARNING,INFORMATIONAL,MOFU,MEDIUM,MEDIUM,PILLAR_BLOG_PAGE,TRUE,
cybersecurity serious games development a systematic review,CTF_BASICS,INFORMATIONAL,TOFU,MEDIUM,LOW,PILLAR_BLOG_PAGE,TRUE,
virtual lab stoichiometric calculations simulation part i,IRRELEVANT_OR_NAVIGATIONAL,INFORMATIONAL,TOFU,LOW,LOW,NONE,FALSE,IRRELEVANT_ENTITY_OR_BRAND
simulation lab scientific research and development center,IRRELEVANT_OR_NAVIGATIONAL,INFORMATIONAL,TOFU,LOW,LOW,NONE,FALSE,IRRELEVANT_ENTITY_OR_BRAND
cyber security training quality thought hyderabad reviews,IRRELEVANT_OR_NAVIGATIONAL,INFORMATIONAL,TOFU,LOW,LOW,NONE,FALSE,IRRELEVANT_ENTITY_OR_BRAND
hands on reciprocal teaching a comprehension technique,IRRELEVANT_OR_NAVIGATIONAL,INFORMATIONAL,TOFU,LOW,LOW,NONE,FALSE,IRRELEVANT_ENTITY_OR_BRAND
population genetics virtual lab simulation answer key,IRRELEVANT_OR_NAVIGATIONAL,INFORMATIONAL,TOFU,LOW,LOW,NONE,FALSE,IRRELEVANT_ENTITY_OR_BRAND
simulation lab tm scientific research and development,IRRELEVANT_OR_NAVIGATIONAL,INFORMATIONAL,TOFU,LOW,LOW,NONE,FALSE,IRRELEVANT_ENTITY_OR_BRAND
information security vs cybersecurity which is better,CYBERSECURITY_CAREER,INFORMATIONAL,TOFU,MEDIUM,MEDIUM,PILLAR_BLOG_PAGE,TRUE,
hands on activities for teaching equivalent fractions,IRRELEVANT_OR_NAVIGATIONAL,INFORMATIONAL,TOFU,LOW,LOW,NONE,FALSE,IRRELEVANT_ENTITY_OR_BRAND
virtual lab yeast fermentation experiment answer key,IRRELEVANT_OR_NAVIGATIONAL,INFORMATIONAL,TOFU,LOW,LOW,NONE,FALSE,IRRELEVANT_ENTITY_OR_BRAND
virtual simulations emerging as the field evolves,IRRELEVANT_OR_NAVIGATIONAL,INFORMATIONAL,TOFU,LOW,LOW,NONE,FALSE,IRRELEVANT_ENTITY_OR_BRAND
how to virtual simulations enhance skill training,IRRELEVANT_OR_NAVIGATIONAL,INFORMATIONAL,TOFU,LOW,LOW,NONE,FALSE,IRRELEVANT_ENTITY_OR_BRAND
cyber security training videos for employees free,CYBER_LAB_LEARNING,INFORMATIONAL,TOFU,LOW,LOW,NONE,FALSE,NOT_RELEVANT_TO_PRODUCT_OFFER
virtual job simulations and short courses forage,IRRELEVANT_OR_NAVIGATIONAL,INFORMATIONAL,TOFU,LOW,LOW,NONE,FALSE,IRRELEVANT_ENTITY_OR_BRAND
auditory visual and hands on teaching techniques,IRRELEVANT_OR_NAVIGATIONAL,INFORMATIONAL,TOFU,LOW,LOW,NONE,FALSE,IRRELEVANT_ENTITY_OR_BRAND
understanding cyber ranges from hype to reality,CTF_BASICS,INFORMATIONAL,TOFU,MEDIUM,LOW,PILLAR_BLOG_PAGE,TRUE,
cybersecurity zero to hero course for beginners,CYBERSECURITY_CAREER,INFORMATIONAL,TOFU,LOW,LOW,NONE,FALSE,NOT_RELEVANT_TO_PRODUCT_OFFER
virtual lab digestive system simulation part i,IRRELEVANT_OR_NAVIGATIONAL,INFORMATIONAL,TOFU,LOW,LOW,NONE,FALSE,IRRELEVANT_ENTITY_OR_BRAND
virtual lab endocrine system simulation part i,IRRELEVANT_OR_NAVIGATIONAL,INFORMATIONAL,TOFU,LOW,LOW,NONE,FALSE,IRRELEVANT_ENTITY_OR_BRAND
virtual lab chemistry safety simulation part i,IRRELEVANT_OR_NAVIGATIONAL,INFORMATIONAL,TOFU,LOW,LOW,NONE,FALSE,IRRELEVANT_ENTITY_OR_BRAND
virtual lab vi characteristics of zener diode,IRRELEVANT_OR_NAVIGATIONAL,INFORMATIONAL,TOFU,LOW,LOW,NONE,FALSE,IRRELEVANT_ENTITY_OR_BRAND
virtual lab view phet simulation rangkaian ac,IRRELEVANT_OR_NAVIGATIONAL,INFORMATIONAL,TOFU,LOW,LOW,NONE,FALSE,IRRELEVANT_ENTITY_OR_BRAND
hands on educational experiences are known as,IRRELEVANT_OR_NAVIGATIONAL,INFORMATIONAL,TOFU,LOW,LOW,NONE,FALSE,IRRELEVANT_ENTITY_OR_BRAND
virtual lab zener diode as voltage regulator,IRRELEVANT_OR_NAVIGATIONAL,INFORMATIONAL,TOFU,LOW,LOW,NONE,FALSE,IRRELEVANT_ENTITY_OR_BRAND
hands on activities for teaching place value,IRRELEVANT_OR_NAVIGATIONAL,INFORMATIONAL,TOFU,LOW,LOW,NONE,FALSE,IRRELEVANT_ENTITY_OR_BRAND
virtual lab is content available from grade,IRRELEVANT_OR_NAVIGATIONAL,INFORMATIONAL,TOFU,LOW,LOW,NONE,FALSE,IRRELEVANT_ENTITY_OR_BRAND
virtual lab simulation free download for pc,IRRELEVANT_OR_NAVIGATIONAL,INFORMATIONAL,TOFU,LOW,LOW,NONE,FALSE,PIRACY_OR_DOWNLOAD_INTENT
how long does cyber security training take,CYBERSECURITY_CAREER,INFORMATIONAL,TOFU,MEDIUM,MEDIUM,PILLAR_BLOG_PAGE,TRUE,
virtual games you can play with coworkers,IRRELEVANT_OR_NAVIGATIONAL,INFORMATIONAL,TOFU,LOW,LOW,NONE,FALSE,NOT_RELEVANT_TO_PRODUCT_OFFER
virtual games you can play with friends,IRRELEVANT_OR_NAVIGATIONAL,INFORMATIONAL,TOFU,LOW,LOW,NONE,FALSE,NOT_RELEVANT_TO_PRODUCT_OFFER
hands on teaching by the primary techie,IRRELEVANT_OR_NAVIGATIONAL,INFORMATIONAL,TOFU,LOW,LOW,NONE,FALSE,NOT_RELEVANT_TO_PRODUCT_OFFER
virtual games you can play on teams,IRRELEVANT_OR_NAVIGATIONAL,INFORMATIONAL,TOFU,LOW,LOW,NONE,FALSE,NOT_RELEVANT_TO_PRODUCT_OFFER
virtual games you can play on zoom,IRRELEVANT_OR_NAVIGATIONAL,INFORMATIONAL,TOFU,LOW,LOW,NONE,FALSE,NOT_RELEVANT_TO_PRODUCT_OFFER
cybersecurity simulation platform creation for training,CTF_PLATFORMS,COMMERCIAL,MOFU,HIGH,HIGH,CORE_PRODUCT_PAGE,TRUE,
virtual lab yeast fermentation experiment (cuhk.edu.hk),IRRELEVANT_OR_NAVIGATIONAL,NAVIGATIONAL,TOFU,LOW,LOW,NONE,FALSE,IRRELEVANT_ENTITY_OR_BRAND
cybersecurity educational games a theoretical framework,CTF_BASICS,INFORMATIONAL,TOFU,MEDIUM,LOW,PILLAR_BLOG_PAGE,TRUE,
cybersecurity enterprises policies a comparative study,IRRELEVANT_OR_NAVIGATIONAL,INFORMATIONAL,TOFU,LOW,LOW,NONE,FALSE,NOT_RELEVANT_TO_PRODUCT_OFFER
hands on primary educational centre pietermaritzburg,IRRELEVANT_OR_NAVIGATIONAL,NAVIGATIONAL,TOFU,LOW,LOW,NONE,FALSE,IRRELEVANT_ENTITY_OR_BRAND
simulation lab scientific research and development,IRRELEVANT_OR_NAVIGATIONAL,INFORMATIONAL,TOFU,LOW,LOW,NONE,FALSE,NOT_RELEVANT_TO_PRODUCT_OFFER
virtual lab yeast fermentation experiment answers,IRRELEVANT_OR_NAVIGATIONAL,INFORMATIONAL,TOFU,LOW,LOW,NONE,FALSE,IRRELEVANT_ENTITY_OR_BRAND
cybersecurity awareness games for employees free,CTF_BASICS,INFORMATIONAL,TOFU,LOW,LOW,NONE,FALSE,NOT_RELEVANT_TO_PRODUCT_OFFER
cyber security training for software developers,CYBERSECURITY_CAREER,COMMERCIAL,MOFU,MEDIUM,MEDIUM,PILLAR_BLOG_PAGE,TRUE,
virtual lab software engineering iit kharagpur,IRRELEVANT_OR_NAVIGATIONAL,NAVIGATIONAL,TOFU,LOW,LOW,NONE,FALSE,IRRELEVANT_ENTITY_OR_BRAND
cyber security training questions and answers,CYBER_LAB_LEARNING,INFORMATIONAL,TOFU,LOW,LOW,NONE,FALSE,NOT_RELEVANT_TO_PRODUCT_OFFER
cybersecurity training with 100 job guarantee,CYBERSECURITY_CAREER,COMMERCIAL,MOFU,MEDIUM,MEDIUM,PILLAR_BLOG_PAGE,TRUE,
cyber security vs cyber security engineering,CYBERSECURITY_CAREER,INFORMATIONAL,TOFU,MEDIUM,MEDIUM,PILLAR_BLOG_PAGE,TRUE,
cybersecurity games for students online free,CTF_BASICS,INFORMATIONAL,TOFU,LOW,LOW,NONE,FALSE,NOT_RELEVANT_TO_PRODUCT_OFFER
cyber security training for business analyst,CYBERSECURITY_CAREER,COMMERCIAL,MOFU,MEDIUM,MEDIUM,PILLAR_BLOG_PAGE,TRUE,
cybersecurity training and placement near me,CYBERSECURITY_CAREER,COMMERCIAL,MOFU,LOW,LOW,NONE,FALSE,LOCAL_SERVICE_INTENT_NEAR_ME
cyber hygiene training for taltech employees,CYBERSECURITY_CAREER,COMMERCIAL,MOFU,MEDIUM,MEDIUM,PILLAR_BLOG_PAGE,TRUE,
iit kharagpur virtual lab simulator download,IRRELEVANT_OR_NAVIGATIONAL,NAVIGATIONAL,TOFU,LOW,LOW,NONE,FALSE,PIRACY_OR_DOWNLOAD_INTENT
online simulation lab roller coaster physics,IRRELEVANT_OR_NAVIGATIONAL,INFORMATIONAL,TOFU,LOW,LOW,NONE,FALSE,NOT_RELEVANT_TO_PRODUCT_OFFER
cybersecurity games for high school students,CTF_BASICS,INFORMATIONAL,TOFU,LOW,LOW,NONE,FALSE,NOT_RELEVANT_TO_PRODUCT_OFFER
cybersecurity training onrender com pre test,IRRELEVANT_OR_NAVIGATIONAL,NAVIGATIONAL,TOFU,LOW,LOW,NONE,FALSE,IRRELEVANT_ENTITY_OR_BRAND
virtual treatment simulation using 3d image,IRRELEVANT_OR_NAVIGATIONAL,INFORMATIONAL,TOFU,LOW,LOW,NONE,FALSE,NOT_RELEVANT_TO_PRODUCT_OFFER
multiplying fractions hands on teaching kit,IRRELEVANT_OR_NAVIGATIONAL,INFORMATIONAL,TOFU,LOW,LOW,NONE,FALSE,NOT_RELEVANT_TO_PRODUCT_OFFER
virtual labs by amrita vishwa vidyapeetham,IRRELEVANT_OR_NAVIGATIONAL,NAVIGATIONAL,TOFU,LOW,LOW,NONE,FALSE,IRRELEVANT_ENTITY_OR_BRAND
lab simulation cell membrane and transport,IRRELEVANT_OR_NAVIGATIONAL,INFORMATIONAL,TOFU,LOW,LOW,NONE,FALSE,IRRELEVANT_ENTITY_OR_BRAND
hands on activities for teaching fractions,IRRELEVANT_OR_NAVIGATIONAL,INFORMATIONAL,TOFU,LOW,LOW,NONE,FALSE,IRRELEVANT_ENTITY_OR_BRAND
virtual job simulations and short courses,IRRELEVANT_OR_NAVIGATIONAL,INFORMATIONAL,TOFU,LOW,LOW,NONE,FALSE,IRRELEVANT_ENTITY_OR_BRAND
cyber range training centre crtc platform,CTF_PLATFORMS,COMMERCIAL,MOFU,HIGH,HIGH,CORE_PRODUCT_PAGE,TRUE,
urinalysis lab simulation human bio media,IRRELEVANT_OR_NAVIGATIONAL,INFORMATIONAL,TOFU,LOW,LOW,NONE,FALSE,IRRELEVANT_ENTITY_OR_BRAND
simulation lab viva questions and answers,ACADEMIC_LAB_MANUALS,INFORMATIONAL,TOFU,LOW,LOW,NONE,FALSE,ACADEMIC_SYLLABUS_NO_COMMERCIAL_VALUE
virtual cricket simulator price in india,IRRELEVANT_OR_NAVIGATIONAL,COMMERCIAL,BOFU,LOW,LOW,NONE,FALSE,IRRELEVANT_ENTITY_OR_BRAND
virtual lab simulation free for students,IRRELEVANT_OR_NAVIGATIONAL,INFORMATIONAL,TOFU,LOW,LOW,NONE,FALSE,PIRACY_OR_DOWNLOAD_INTENT
why cyber security training is important,CYBERSECURITY_CAREER,INFORMATIONAL,TOFU,MEDIUM,MEDIUM,PILLAR_BLOG_PAGE,TRUE,
virtual lab hematology simulation part i,IRRELEVANT_OR_NAVIGATIONAL,INFORMATIONAL,TOFU,LOW,LOW,NONE,FALSE,IRRELEVANT_ENTITY_OR_BRAND
virtual lab microscopy simulation part i,IRRELEVANT_OR_NAVIGATIONAL,INFORMATIONAL,TOFU,LOW,LOW,NONE,FALSE,IRRELEVANT_ENTITY_OR_BRAND
hands on educational supply store photos,IRRELEVANT_OR_NAVIGATIONAL,INFORMATIONAL,TOFU,LOW,LOW,NONE,FALSE,IRRELEVANT_ENTITY_OR_BRAND
virtual labs help students by providing,IRRELEVANT_OR_NAVIGATIONAL,INFORMATIONAL,TOFU,LOW,LOW,NONE,FALSE,IRRELEVANT_ENTITY_OR_BRAND
cyber training login united states army,IRRELEVANT_OR_NAVIGATIONAL,NAVIGATIONAL,TOFU,LOW,LOW,NONE,FALSE,IRRELEVANT_ENTITY_OR_BRAND
cyber security drill scenario for ships,CYBER_LAB_LEARNING,INFORMATIONAL,MOFU,HIGH,MEDIUM,PILLAR_BLOG_PAGE,TRUE,
virtual labs need perspective and scope,IRRELEVANT_OR_NAVIGATIONAL,INFORMATIONAL,TOFU,LOW,LOW,NONE,FALSE,IRRELEVANT_ENTITY_OR_BRAND
virtual lab vi characteristics of diode,IRRELEVANT_OR_NAVIGATIONAL,INFORMATIONAL,TOFU,LOW,LOW,NONE,FALSE,IRRELEVANT_ENTITY_OR_BRAND
online enzyme lab simulation answer key,IRRELEVANT_OR_NAVIGATIONAL,INFORMATIONAL,TOFU,LOW,LOW,NONE,FALSE,IRRELEVANT_ENTITY_OR_BRAND
cybersecurity zero to hero by microsoft,CYBERSECURITY_CAREER,COMMERCIAL,MOFU,MEDIUM,MEDIUM,PILLAR_BLOG_PAGE,TRUE,
hands on early education school reviews,IRRELEVANT_OR_NAVIGATIONAL,INFORMATIONAL,TOFU,LOW,LOW,NONE,FALSE,IRRELEVANT_ENTITY_OR_BRAND
hands on activities for teaching volume,IRRELEVANT_OR_NAVIGATIONAL,INFORMATIONAL,TOFU,LOW,LOW,NONE,FALSE,IRRELEVANT_ENTITY_OR_BRAND
hands on activities for teaching angles,IRRELEVANT_OR_NAVIGATIONAL,INFORMATIONAL,TOFU,LOW,LOW,NONE,FALSE,IRRELEVANT_ENTITY_OR_BRAND
little hands on education greensboro nc,IRRELEVANT_OR_NAVIGATIONAL,NAVIGATIONAL,TOFU,LOW,LOW,NONE,FALSE,LOCAL_SERVICE_INTENT_NEAR_ME
hands on technology education san diego,IRRELEVANT_OR_NAVIGATIONAL,NAVIGATIONAL,TOFU,LOW,LOW,NONE,FALSE,LOCAL_SERVICE_INTENT_NEAR_ME
is there programming in cyber security,CYBERSECURITY_CAREER,INFORMATIONAL,TOFU,MEDIUM,MEDIUM,PILLAR_BLOG_PAGE,TRUE,
virtual lab kiska simulation karti hai,IRRELEVANT_OR_NAVIGATIONAL,INFORMATIONAL,TOFU,LOW,LOW,NONE,FALSE,IRRELEVANT_ENTITY_OR_BRAND
hands on bible teacher divided kingdom,IRRELEVANT_OR_NAVIGATIONAL,INFORMATIONAL,TOFU,LOW,LOW,NONE,FALSE,IRRELEVANT_ENTITY_OR_BRAND
cyber security training the inside man,CYBERSECURITY_CAREER,INFORMATIONAL,TOFU,MEDIUM,MEDIUM,PILLAR_BLOG_PAGE,TRUE,
what is virtual simulation in nursing,IRRELEVANT_OR_NAVIGATIONAL,INFORMATIONAL,TOFU,LOW,LOW,NONE,FALSE,IRRELEVANT_ENTITY_OR_BRAND
virtual labs for high school students,IRRELEVANT_OR_NAVIGATIONAL,INFORMATIONAL,TOFU,LOW,LOW,NONE,FALSE,NOT_RELEVANT_TO_PRODUCT_OFFER
cybersecurity how to stay safe online,IRRELEVANT_OR_NAVIGATIONAL,INFORMATIONAL,TOFU,LOW,LOW,NONE,FALSE,NOT_RELEVANT_TO_PRODUCT_OFFER
is javascript good for cyber security,CYBER_LAB_REQUIREMENTS,INFORMATIONAL,TOFU,LOW,LOW,PILLAR_BLOG_PAGE,FALSE,NOT_RELEVANT_TO_PRODUCT_OFFER
hands on learning in teaching science,IRRELEVANT_OR_NAVIGATIONAL,INFORMATIONAL,TOFU,LOW,LOW,NONE,FALSE,NOT_RELEVANT_TO_PRODUCT_OFFER
examples of hands on teaching methods,IRRELEVANT_OR_NAVIGATIONAL,INFORMATIONAL,TOFU,LOW,LOW,NONE,FALSE,NOT_RELEVANT_TO_PRODUCT_OFFER
cyber security training new york city,IRRELEVANT_OR_NAVIGATIONAL,COMMERCIAL,MOFU,LOW,LOW,NONE,FALSE,LOCAL_SERVICE_INTENT_NEAR_ME
cyber security platform as a service,CTF_PLATFORMS,COMMERCIAL,BOFU,HIGH,HIGH,CORE_PRODUCT_PAGE,TRUE,
virtual games to play with coworkers,IRRELEVANT_OR_NAVIGATIONAL,INFORMATIONAL,TOFU,LOW,LOW,NONE,FALSE,NOT_RELEVANT_TO_PRODUCT_OFFER
virtual zoom games for team building,IRRELEVANT_OR_NAVIGATIONAL,INFORMATIONAL,TOFU,LOW,LOW,NONE,FALSE,NOT_RELEVANT_TO_PRODUCT_OFFER
what software do cyber security use,CYBER_LAB_REQUIREMENTS,INFORMATIONAL,TOFU,MEDIUM,MEDIUM,PILLAR_BLOG_PAGE,TRUE,
what programs do cyber security use,CYBER_LAB_REQUIREMENTS,INFORMATIONAL,TOFU,MEDIUM,MEDIUM,PILLAR_BLOG_PAGE,TRUE,
hands on teaching ideas escape room,IRRELEVANT_OR_NAVIGATIONAL,INFORMATIONAL,TOFU,LOW,LOW,NONE,FALSE,NOT_RELEVANT_TO_PRODUCT_OFFER
virtual zoom games for large groups,IRRELEVANT_OR_NAVIGATIONAL,INFORMATIONAL,TOFU,LOW,LOW,NONE,FALSE,NOT_RELEVANT_TO_PRODUCT_OFFER
virtual lab young ave moorestown nj,IRRELEVANT_OR_NAVIGATIONAL,NAVIGATIONAL,TOFU,LOW,LOW,NONE,FALSE,LOCAL_SERVICE_INTENT_NEAR_ME
virtual lab redox simulation part i,IRRELEVANT_OR_NAVIGATIONAL,INFORMATIONAL,TOFU,LOW,LOW,NONE,FALSE,NOT_RELEVANT_TO_PRODUCT_OFFER
kypo cyber range platform kypo crp,CTF_PLATFORMS,COMMERCIAL,BOFU,HIGH,HIGH,COMPARISON_PAGE,TRUE,
cyber security course how to learn,CYBERSECURITY_CAREER,INFORMATIONAL,TOFU,MEDIUM,MEDIUM,PILLAR_BLOG_PAGE,TRUE,
cyber security training what is it,CYBERSECURITY_CAREER,INFORMATIONAL,TOFU,MEDIUM,MEDIUM,PILLAR_BLOG_PAGE,TRUE,
cyber cafe training center near me,IRRELEVANT_OR_NAVIGATIONAL,COMMERCIAL,MOFU,LOW,LOW,NONE,FALSE,LOCAL_SERVICE_INTENT_NEAR_ME
virtual games to play with friends,IRRELEVANT_OR_NAVIGATIONAL,INFORMATIONAL,TOFU,LOW,LOW,NONE,FALSE,NOT_RELEVANT_TO_PRODUCT_OFFER
hands on teaching bullhead city az,IRRELEVANT_OR_NAVIGATIONAL,COMMERCIAL,MOFU,LOW,LOW,NONE,FALSE,LOCAL_SERVICE_INTENT_NEAR_ME
hands on education centre by owner,IRRELEVANT_OR_NAVIGATIONAL,COMMERCIAL,MOFU,LOW,LOW,NONE,FALSE,LOCAL_SERVICE_INTENT_NEAR_ME
hands on learning royal palm beach,IRRELEVANT_OR_NAVIGATIONAL,COMMERCIAL,MOFU,LOW,LOW,NONE,FALSE,LOCAL_SERVICE_INTENT_NEAR_ME
another word for hands on teaching,IRRELEVANT_OR_NAVIGATIONAL,INFORMATIONAL,TOFU,LOW,LOW,NONE,FALSE,NOT_RELEVANT_TO_PRODUCT_OFFER
virtual labs and stem e resources,IRRELEVANT_OR_NAVIGATIONAL,INFORMATIONAL,TOFU,LOW,LOW,NONE,FALSE,NOT_RELEVANT_TO_PRODUCT_OFFER
hands on learning in teaching epp,IRRELEVANT_OR_NAVIGATIONAL,INFORMATIONAL,TOFU,LOW,LOW,NONE,FALSE,NOT_RELEVANT_TO_PRODUCT_OFFER
cyberpunk smart vs tech vs power,IRRELEVANT_OR_NAVIGATIONAL,INFORMATIONAL,TOFU,LOW,LOW,NONE,FALSE,NOT_RELEVANT_TO_PRODUCT_OFFER
virtual labs are best defined as,IRRELEVANT_OR_NAVIGATIONAL,INFORMATIONAL,TOFU,LOW,LOW,NONE,FALSE,NOT_RELEVANT_TO_PRODUCT_OFFER
what is hands on teaching method,IRRELEVANT_OR_NAVIGATIONAL,INFORMATIONAL,TOFU,LOW,LOW,NONE,FALSE,NOT_RELEVANT_TO_PRODUCT_OFFER
what is hands on teaching called,IRRELEVANT_OR_NAVIGATIONAL,INFORMATIONAL,TOFU,LOW,LOW,NONE,FALSE,NOT_RELEVANT_TO_PRODUCT_OFFER
masters in cyber security in usa,CYBERSECURITY_CAREER,INFORMATIONAL,TOFU,MEDIUM,MEDIUM,PILLAR_BLOG_PAGE,TRUE,
what does hands on teaching mean,IRRELEVANT_OR_NAVIGATIONAL,INFORMATIONAL,TOFU,LOW,LOW,NONE,FALSE,NOT_RELEVANT_TO_PRODUCT_OFFER
cyber ranges uk and ireland ltd,IRRELEVANT_OR_NAVIGATIONAL,NAVIGATIONAL,TOFU,LOW,LOW,NONE,FALSE,IRRELEVANT_ENTITY_OR_BRAND
virtual labs nmsu edu micro php,IRRELEVANT_OR_NAVIGATIONAL,NAVIGATIONAL,TOFU,LOW,LOW,NONE,FALSE,IRRELEVANT_ENTITY_OR_BRAND
is hands on a teaching strategy,IRRELEVANT_OR_NAVIGATIONAL,INFORMATIONAL,TOFU,LOW,LOW,NONE,FALSE,NOT_RELEVANT_TO_PRODUCT_OFFER
what is saas in cyber security,CTF_BASICS,INFORMATIONAL,TOFU,MEDIUM,LOW,PILLAR_BLOG_PAGE,TRUE,
cybersecurity how to get a job,CYBERSECURITY_CAREER,INFORMATIONAL,TOFU,MEDIUM,MEDIUM,PILLAR_BLOG_PAGE,TRUE,
hands on vs hands off teaching,IRRELEVANT_OR_NAVIGATIONAL,INFORMATIONAL,TOFU,LOW,LOW,NONE,FALSE,NOT_RELEVANT_TO_PRODUCT_OFFER
how to train in cyber security,CYBER_LAB_LEARNING,INFORMATIONAL,TOFU,MEDIUM,LOW,PILLAR_BLOG_PAGE,TRUE,
virtual games to play on teams,IRRELEVANT_OR_NAVIGATIONAL,INFORMATIONAL,TOFU,LOW,LOW,NONE,FALSE,NOT_RELEVANT_TO_PRODUCT_OFFER
cyber gnr range gujarat gov in,IRRELEVANT_OR_NAVIGATIONAL,NAVIGATIONAL,TOFU,LOW,LOW,NONE,FALSE,IRRELEVANT_ENTITY_OR_BRAND
virtual games to play on zoom,IRRELEVANT_OR_NAVIGATIONAL,INFORMATIONAL,TOFU,LOW,LOW,NONE,FALSE,NOT_RELEVANT_TO_PRODUCT_OFFER
hitcon cyber range x ctf 2025,CTF_PLATFORMS,INFORMATIONAL,TOFU,HIGH,HIGH,CORE_PRODUCT_PAGE,TRUE,
cyber security is good or bad,IRRELEVANT_OR_NAVIGATIONAL,INFORMATIONAL,TOFU,LOW,LOW,NONE,FALSE,NOT_RELEVANT_TO_PRODUCT_OFFER
how much do basic labs cost,CYBER_LAB_REQUIREMENTS,COMMERCIAL,MOFU,MEDIUM,LOW,PILLAR_BLOG_PAGE,TRUE,
is teaching a hands on job,IRRELEVANT_OR_NAVIGATIONAL,INFORMATIONAL,TOFU,LOW,LOW,NONE,FALSE,NOT_RELEVANT_TO_PRODUCT_OFFER
cybersecurity awareness training platform project,CTF_PLATFORMS,COMMERCIAL,BOFU,HIGH,HIGH,CORE_PRODUCT_PAGE,TRUE,
cybersecurity and infrastructure security agency,IRRELEVANT_OR_NAVIGATIONAL,NAVIGATIONAL,TOFU,LOW,LOW,NONE,FALSE,IRRELEVANT_ENTITY_OR_BRAND
cybersecurity awareness training best practices,CYBER_LAB_LEARNING,INFORMATIONAL,TOFU,MEDIUM,LOW,PILLAR_BLOG_PAGE,TRUE,
cybersecurity training institutes in hyderabad,IRRELEVANT_OR_NAVIGATIONAL,COMMERCIAL,TOFU,LOW,LOW,NONE,FALSE,LOCAL_SERVICE_INTENT_NEAR_ME
cybersecurity training institutes in bangalore,IRRELEVANT_OR_NAVIGATIONAL,COMMERCIAL,TOFU,LOW,LOW,NONE,FALSE,LOCAL_SERVICE_INTENT_NEAR_ME
cybersecurity training onrender com collection,IRRELEVANT_OR_NAVIGATIONAL,NAVIGATIONAL,TOFU,LOW,LOW,NONE,FALSE,IRRELEVANT_ENTITY_OR_BRAND
virtual reality simulations offer experiences,IRRELEVANT_OR_NAVIGATIONAL,INFORMATIONAL,TOFU,LOW,LOW,NONE,FALSE,NOT_RELEVANT_TO_PRODUCT_OFFER
cisco cybersecurity readiness assessment tool,IRRELEVANT_OR_NAVIGATIONAL,NAVIGATIONAL,TOFU,LOW,LOW,NONE,FALSE,IRRELEVANT_ENTITY_OR_BRAND
cybersecurity training programs for employees,CYBER_LAB_LEARNING,COMMERCIAL,MOFU,HIGH,LOW,PILLAR_BLOG_PAGE,TRUE,
cybersecurity training and awareness programs,CYBER_LAB_LEARNING,COMMERCIAL,MOFU,HIGH,LOW,PILLAR_BLOG_PAGE,TRUE,
cyber hygiene training completion certificate,CYBER_LAB_LEARNING,COMMERCIAL,MOFU,MEDIUM,LOW,PILLAR_BLOG_PAGE,TRUE,
virtual lab simulation electrical engineering,IRRELEVANT_OR_NAVIGATIONAL,INFORMATIONAL,TOFU,LOW,LOW,NONE,FALSE,NOT_RELEVANT_TO_PRODUCT_OFFER
virtual laboratories and technical simulators,CYBER_LAB_SETUP,INFORMATIONAL,TOFU,MEDIUM,MEDIUM,PILLAR_BLOG_PAGE,TRUE,
cybersecurity best practices for individuals,CYBER_LAB_LEARNING,INFORMATIONAL,TOFU,LOW,LOW,PILLAR_BLOG_PAGE,FALSE,NOT_RELEVANT_TO_PRODUCT_OFFER
cybersecurity vs software engineering salary,CYBERSECURITY_CAREER,INFORMATIONAL,TOFU,MEDIUM,MEDIUM,PILLAR_BLOG_PAGE,TRUE,
cybersecurity training programs for veterans,CYBERSECURITY_CAREER,INFORMATIONAL,TOFU,MEDIUM,MEDIUM,PILLAR_BLOG_PAGE,TRUE,
cybersecurity insurance modeling and pricing,IRRELEVANT_OR_NAVIGATIONAL,INFORMATIONAL,TOFU,LOW,LOW,NONE,FALSE,NOT_RELEVANT_TO_PRODUCT_OFFER
nitda cybersecurity training young nigerians,IRRELEVANT_OR_NAVIGATIONAL,INFORMATIONAL,TOFU,LOW,LOW,NONE,FALSE,IRRELEVANT_ENTITY_OR_BRAND
cybersecurity best practices for businesses,CYBER_LAB_LEARNING,INFORMATIONAL,TOFU,MEDIUM,LOW,PILLAR_BLOG_PAGE,TRUE,
cybersecurity games for elementary students,CYBER_LAB_LEARNING,INFORMATIONAL,TOFU,LOW,LOW,NONE,FALSE,NOT_RELEVANT_TO_PRODUCT_OFFER
cybersecurity training for business leaders,CYBER_LAB_LEARNING,INFORMATIONAL,TOFU,MEDIUM,LOW,PILLAR_BLOG_PAGE,TRUE,
cyber training noreply getcybertraining com,IRRELEVANT_OR_NAVIGATIONAL,NAVIGATIONAL,TOFU,LOW,LOW,NONE,FALSE,IRRELEVANT_ENTITY_OR_BRAND
cybersecurity awareness games for employees,CYBER_LAB_LEARNING,INFORMATIONAL,TOFU,MEDIUM,LOW,PILLAR_BLOG_PAGE,TRUE,
cybersecurity training for small businesses,CYBER_LAB_LEARNING,INFORMATIONAL,TOFU,MEDIUM,LOW,PILLAR_BLOG_PAGE,TRUE,
cybersecurity training videos for employees,CYBER_LAB_LEARNING,INFORMATIONAL,TOFU,MEDIUM,LOW,PILLAR_BLOG_PAGE,TRUE,
virtual labs electronics and communication,IRRELEVANT_OR_NAVIGATIONAL,INFORMATIONAL,TOFU,LOW,LOW,NONE,FALSE,NOT_RELEVANT_TO_PRODUCT_OFFER
virtual lab simulation digital electronics,IRRELEVANT_OR_NAVIGATIONAL,INFORMATIONAL,TOFU,LOW,LOW,NONE,FALSE,NOT_RELEVANT_TO_PRODUCT_OFFER
simulation lab coordinator job description,IRRELEVANT_OR_NAVIGATIONAL,INFORMATIONAL,TOFU,LOW,LOW,NONE,FALSE,NOT_RELEVANT_TO_PRODUCT_OFFER
hands on education centre pietermaritzburg,IRRELEVANT_OR_NAVIGATIONAL,NAVIGATIONAL,TOFU,LOW,LOW,NONE,FALSE,IRRELEVANT_ENTITY_OR_BRAND
cybersecurity awareness training + youtube,CYBER_LAB_LEARNING,INFORMATIONAL,TOFU,MEDIUM,LOW,PILLAR_BLOG_PAGE,TRUE,
cybersecurity software for small business,CYBER_LAB_REQUIREMENTS,COMMERCIAL,MOFU,MEDIUM,LOW,PILLAR_BLOG_PAGE,TRUE,
cybersecurity open source projects github,CYBER_LAB_REQUIREMENTS,INFORMATIONAL,TOFU,MEDIUM,LOW,PILLAR_BLOG_PAGE,TRUE,
cybersecurity training and awareness jobs,CYBERSECURITY_CAREER,INFORMATIONAL,TOFU,MEDIUM,MEDIUM,PILLAR_BLOG_PAGE,TRUE,
